[
  {
    "id": "denabicr_20130809_020959",
    "title": "Great Grey Owl Call With Whooping End Variation",
    "category": "Birds",
    "category_folder": "BIRDS",
    "park_code": "DENA",
    "site_code": "BICR",
    "recorded_date": "2013-08-09",
    "recorded_time": "02:09:59",
    "description": "Great Grey Owl Call With Whooping End Variation",
    "audio_path": "highlights/audio/BIRDS/DENABICR_20130809_020959 Great Grey Owl Call With Whooping End Variation TRIM, NOISE REDUCTION, AMPLIFY.mp3",
    "spectrogram_path": "highlights/spectrograms/BIRDS/DENABICR_20130809_020959 Great Grey Owl Call With Whooping End Variation TRIM, NOISE REDUCTION, AMPLIFY.png",
    "duration_sec": 16.4,
    "sample_rate": 44100,
    "format": "mp3",
    "file_size_bytes": 396250,
    "artist": "National Park Service",
    "species_common": null,
    "species_scientific": null,
    "xc_quality": null,
    "site_photo_path": "highlights/site_photos/denabicr_20130809_020959.webp",
    "site_photo_year": "2013",
    "site_name": "Birch Creek"
  },
  {
    "id": "denafang_20110708_023655",
    "title": "White-Tailed Ptarmigan",
    "category": "Birds",
    "category_folder": "BIRDS",
    "park_code": "DENA",
    "site_code": "FANG",
    "recorded_date": "2011-07-08",
    "recorded_time": "02:36:55",
    "description": "White-Tailed Ptarmigan",
    "audio_path": "highlights/audio/BIRDS/DENAFANG_20110708_023655_White-Tailed Ptarmigan BESSEL BANDPASS 70 Hz 7000 Hz TRIM.mp3",
    "spectrogram_path": "highlights/spectrograms/BIRDS/DENAFANG_20110708_023655_White-Tailed Ptarmigan BESSEL BANDPASS 70 Hz 7000 Hz TRIM.png",
    "duration_sec": 16.4,
    "sample_rate": 48000,
    "format": "mp3",
    "file_size_bytes": 396774,
    "artist": "National Park Service",
    "species_common": null,
    "species_scientific": null,
    "xc_quality": null,
    "site_photo_path": "highlights/site_photos/denafang_20110708_023655.webp",
    "site_photo_year": "2011",
    "site_name": "Fang Mountain"
  },
  {
    "id": "denahauk_20140606_035354",
    "title": "Northern Waterthrush Song With Chorus",
    "category": "Birds",
    "category_folder": "BIRDS",
    "park_code": "DENA",
    "site_code": "HAUK",
    "recorded_date": "2014-06-06",
    "recorded_time": "03:53:54",
    "description": "Northern Waterthrush Song With Chorus",
    "audio_path": "highlights/audio/BIRDS/DENAHAUK_20140606_035354 Northern Waterthrush Song With Chorus TRIM.mp3",
    "spectrogram_path": "highlights/spectrograms/BIRDS/DENAHAUK_20140606_035354 Northern Waterthrush Song With Chorus TRIM.png",
    "duration_sec": 69.8,
    "sample_rate": 48000,
    "format": "mp3",
    "file_size_bytes": 1676068,
    "artist": "National Park Service",
    "species_common": null,
    "species_scientific": null,
    "xc_quality": null,
    "site_photo_path": "highlights/site_photos/denahauk_20140606_035354.webp",
    "site_photo_year": "2014",
    "site_name": "Hauke Creek"
  },
  {
    "id": "denahauk_20140607_214150",
    "title": "Varied Thrush Song Long Sequence",
    "category": "Birds",
    "category_folder": "BIRDS",
    "park_code": "DENA",
    "site_code": "HAUK",
    "recorded_date": "2014-06-07",
    "recorded_time": "21:41:50",
    "description": "Varied Thrush Song Long Sequence",
    "audio_path": "highlights/audio/BIRDS/DENAHAUK_20140607_214150 Varied Thrush Song Long Sequence TRIM BANDPASS 700 - 8000 Hz AMPLIFY +20 dBu TRIM.mp3",
    "spectrogram_path": "highlights/spectrograms/BIRDS/DENAHAUK_20140607_214150 Varied Thrush Song Long Sequence TRIM BANDPASS 700 - 8000 Hz AMPLIFY +20 dBu TRIM.png",
    "duration_sec": 40.6,
    "sample_rate": 48000,
    "format": "mp3",
    "file_size_bytes": 977430,
    "artist": "National Park Service",
    "species_common": null,
    "species_scientific": null,
    "xc_quality": null,
    "site_photo_path": "highlights/site_photos/denahauk_20140607_214150.webp",
    "site_photo_year": "2014",
    "site_name": "Hauke Creek"
  },
  {
    "id": "denahig1_20120802_035742",
    "title": "Willow Ptarmigan",
    "category": "Birds",
    "category_folder": "BIRDS",
    "park_code": "DENA",
    "site_code": "HIG1",
    "recorded_date": "2012-08-02",
    "recorded_time": "03:57:42",
    "description": "Willow Ptarmigan",
    "audio_path": "highlights/audio/BIRDS/DENAHIG1_20120802_035742 Willow Ptarmigan.mp3",
    "spectrogram_path": "highlights/spectrograms/BIRDS/DENAHIG1_20120802_035742 Willow Ptarmigan.png",
    "duration_sec": 7.4,
    "sample_rate": 44100,
    "format": "mp3",
    "file_size_bytes": 180340,
    "artist": "National Park Service",
    "species_common": null,
    "species_scientific": null,
    "xc_quality": null,
    "site_photo_path": "highlights/site_photos/denahig1_20120802_035742.webp",
    "site_photo_year": "2012",
    "site_name": "Highway Pass 1"
  },
  {
    "id": "denahog3_20120601_034833",
    "title": "Fox Sparrow Song With Possible Calls and Chorus",
    "category": "Birds",
    "category_folder": "BIRDS",
    "park_code": "DENA",
    "site_code": "HOG3",
    "recorded_date": "2012-06-01",
    "recorded_time": "03:48:33",
    "description": "Fox Sparrow Song With Possible Calls and Chorus",
    "audio_path": "highlights/audio/BIRDS/DENAHOG3_20120601_034833 Fox Sparrow Song With Possible Calls and Chorus.mp3",
    "spectrogram_path": "highlights/spectrograms/BIRDS/DENAHOG3_20120601_034833 Fox Sparrow Song With Possible Calls and Chorus.png",
    "duration_sec": 207.0,
    "sample_rate": 44100,
    "format": "mp3",
    "file_size_bytes": 4970204,
    "artist": "National Park Service",
    "species_common": null,
    "species_scientific": null,
    "xc_quality": null,
    "site_photo_path": "highlights/site_photos/denahog3_20120601_034833.webp",
    "site_photo_year": "2012",
    "site_name": "Hogan Creek 3"
  },
  {
    "id": "denahog3_20120605_074102",
    "title": "American Tree Sparrow Song With Chorus",
    "category": "Birds",
    "category_folder": "BIRDS",
    "park_code": "DENA",
    "site_code": "HOG3",
    "recorded_date": "2012-06-05",
    "recorded_time": "07:41:02",
    "description": "American Tree Sparrow Song With Chorus",
    "audio_path": "highlights/audio/BIRDS/DENAHOG3_20120605_074102 American Tree Sparrow Song With Chorus.mp3",
    "spectrogram_path": "highlights/spectrograms/BIRDS/DENAHOG3_20120605_074102 American Tree Sparrow Song With Chorus.png",
    "duration_sec": 70.3,
    "sample_rate": 48000,
    "format": "mp3",
    "file_size_bytes": 1690424,
    "artist": "National Park Service",
    "species_common": null,
    "species_scientific": null,
    "xc_quality": null,
    "site_photo_path": "highlights/site_photos/denahog3_20120605_074102.webp",
    "site_photo_year": "2012",
    "site_name": "Hogan Creek 3"
  },
  {
    "id": "denahots_20140602_085834",
    "title": "Common Raven Croak Calls, Popping Call, and Water Droplet With Reverberation",
    "category": "Birds",
    "category_folder": "BIRDS",
    "park_code": "DENA",
    "site_code": "HOTS",
    "recorded_date": "2014-06-02",
    "recorded_time": "08:58:34",
    "description": "Common Raven Croak Calls, Popping Call, and Water Droplet With Reverberation",
    "audio_path": "highlights/audio/BIRDS/DENAHOTS_20140602_085834 Common Raven Croak Calls, Popping Call, and Water Droplet With Reverberation TRIM BANDPASS 300 - 8000 Hz AMPLIFY _15 dBu.mp3",
    "spectrogram_path": "highlights/spectrograms/BIRDS/DENAHOTS_20140602_085834 Common Raven Croak Calls, Popping Call, and Water Droplet With Reverberation TRIM BANDPASS 300 - 8000 Hz AMPLIFY _15 dBu.png",
    "duration_sec": 52.2,
    "sample_rate": 48000,
    "format": "mp3",
    "file_size_bytes": 1255754,
    "artist": "National Park Service",
    "species_common": null,
    "species_scientific": null,
    "xc_quality": null,
    "site_photo_path": "highlights/site_photos/denahots_20140602_085834.webp",
    "site_photo_year": "2014",
    "site_name": "Hot Slough"
  },
  {
    "id": "denakich_20120524_081441",
    "title": "Wandering Tattler With Golden-Crowned Sparrow and Fox Sparrow Chorus",
    "category": "Birds",
    "category_folder": "BIRDS",
    "park_code": "DENA",
    "site_code": "KICH",
    "recorded_date": "2012-05-24",
    "recorded_time": "08:14:41",
    "description": "Wandering Tattler With Golden-Crowned Sparrow and Fox Sparrow Chorus",
    "audio_path": "highlights/audio/BIRDS/DENAKICH_20120524_081441 Wandering Tattler With Golden-Crowned Sparrow and Fox Sparrow Chorus TRIM.mp3",
    "spectrogram_path": "highlights/spectrograms/BIRDS/DENAKICH_20120524_081441 Wandering Tattler With Golden-Crowned Sparrow and Fox Sparrow Chorus TRIM.png",
    "duration_sec": 18.8,
    "sample_rate": 44100,
    "format": "mp3",
    "file_size_bytes": 451885,
    "artist": "National Park Service",
    "species_common": null,
    "species_scientific": null,
    "xc_quality": null,
    "site_photo_path": "highlights/site_photos/denakich_20120524_081441.webp",
    "site_photo_year": "2012",
    "site_name": "Kichatna Mountains"
  },
  {
    "id": "denamuri_20150516_050450",
    "title": "Common Loon With Robust Chorus",
    "category": "Birds",
    "category_folder": "BIRDS",
    "park_code": "DENA",
    "site_code": "MURI",
    "recorded_date": "2015-05-16",
    "recorded_time": "05:04:50",
    "description": "Common Loon With Robust Chorus",
    "audio_path": "highlights/audio/BIRDS/DENAMURI_20150516_050450 Common Loon With Robust Chorus TRIM.mp3",
    "spectrogram_path": "highlights/spectrograms/BIRDS/DENAMURI_20150516_050450 Common Loon With Robust Chorus TRIM.png",
    "duration_sec": 23.3,
    "sample_rate": 48000,
    "format": "mp3",
    "file_size_bytes": 561466,
    "artist": "National Park Service",
    "species_common": null,
    "species_scientific": null,
    "xc_quality": null,
    "site_photo_path": "highlights/site_photos/denamuri_20150516_050450.webp",
    "site_photo_year": "2015",
    "site_name": "Muddy River"
  },
  {
    "id": "denamuri_20150519_094517",